,Subject,date_published,verified,review_text,type_of_traveller,seat_type,route,date_flown,seat_comfort,cabin_staff_service,food_&_beverages,inflight_entertainment,ground_service,wifi_&_connectivity,value_for_money,recommended,aircraft
26,air-seychelles,2015-01-13 00:12:00,,"Johannesburg to Praslin via Mahe with Air Seychelles. Our flight departure time was at 14h00 and the arrival time in Mahe very close to midnight. From Johannesburg the service was extremely slow as our trays were cleared more than an hour after the service commenced. I will not even comment on the food served as my tray went straight to their exit bin. The departure time from Johannesburg is clearly problematic if one considers the crew on duty had just come from Seychelles and with a turnaround of possibly an hour or less, they must have been on duty from very early morning. It would be interesting to know whether the same crew returns the aircraft or whether there was indeed another crew returning to Seychelles. If a different crew did duty on the return flight then their tardy service is unforgiveable. If the reverse is true, then surely their hours on duty exceeded the norm. For folk travelling from South Africa and seated in the economy class, sleep well the night before your departure. Do not try and extend your seat and then expect the passenger behind you to be happy having a stranger sleeping on their lap - when service starts you have to be asked to please place your seat in the upright position. On our return the menu was just as terrible - fancy being told they do not have the omelette which is first on their very fancy menu card and your choice is frittata or bread pudding for breakfast. The service was better, the crew were well trained but the noise from passengers and children was chronic, we at times wished their was an escape route and a parachute available. We have travelled to many destinations on various flights - longer flights do deserve the extra charges which we willingly pay, but never have we been so delighted to end our flight. Mahe Airport is in serious need of better seating and air conditioning - being the departure point from all the islands. Praslin Airport was cleaner and better equipped.",Couple Leisure,Economy Class,JNB to PRI via SEZ,November 2015,3.0,2.0,1.0,1.0,1.0,2.0,1,no,A330
27,air-seychelles,2015-01-12 00:12:00,,"Flew Air Seychelles from SEZ to BOM. Purchased an upgrade at the lounge in Mahe Airport - handled in a professional manner. Seat comfort ok for 4hr 30min flight. Entertainment was Etihad ebox so there was plenty of choice. Dinner served was excellent - fish roulade, chicken curry. South African sauvignon blanc was good. Friendly efficient crew. wifi and sms available. On time arrival into Mumbai.",Solo Leisure,Business Class,SEZ to BOM,December 2015,3.0,5.0,5.0,5.0,5.0,5.0,4,yes,A320-200
28,air-seychelles,2015-01-04 00:06:00,,We flew AUH-SEZ and return on Air Seychelles operated by Etihad Aircraft. The flights were both very empty with no more that 35 passengers on each sector. The flights left on time or even 30 minutes early as we found when leaving Victoria. The crew on both sectors were very friendly and professional. The quality of food was good on all flights and the crew continued to come round with water throughout the night. The entertainment was from Etihad's ebox selection which was very good and had an up to date film television and music selection on demand.,,Economy Class,,,4.0,4.0,4.0,4.0,,,4,yes,
29,air-seychelles,2015-01-02 00:05:00,,We flew JNB to Seychelles on 21 April and back on 1 May 2015. The Cabin was good and the seat comfort very good - not completely lie flat but very close and much more comfortable than Emirates Business Class. Service is what you would expect from Business class. Outward bound trip from Johannesburg was good. Nightmare was on Inbound trip. The flight departure time was 8am but at around 5pm the evening prior to the flight they sent an email out to the travel agents that they have moved the departure time 1 hour earlier. They didn't contact the customers themselves and no one with authority at Air Seychelles was available to talk to. For people on Mahe the 1 hour earlier departure wasn't the end of the world but for people on the outlying islands who relied on a regular ferry service there was no way to make our flight and flights for next 3 days were fully booked. In the end we had to charter a boat to get us to the airport on time we were the lucky ones - others missed their flight completely. It seems that customer service is not something Air Seychelles understands. The flight back was uneventful except that 2 of the seats in business class were out of order and that the cabin staff were extremely noisy talking non stop at high volume throughout the flight. Sleeping wasn't easy but they just didn't care.,,Business Class,,,4.0,3.0,0.0,0.0,,,5,no,
30,air-seychelles,2015-01-01 00:05:00,,I fly to Seychelles frequently and unfortunately as a Silver member of Etihad I fly Air Seychelles from Abu Dhabi to Seychelles. The services are terrible. Firstly they talk way too much all those announcements! From fasten your seatbelts to marketing their duty free it is in 3-4 languages. They start in English them French then Creole. Safety info presented in English and Arabic. Fasten seatbelts warning start with Chinese. The whole flight you listen to this nonsense. Entertainment system is very limited food is not great either. The most annoying thing for me is that as a Silver member I have never been able to upgrade with miles. They will not do it at the airport and even the manager on duty does not know how this is done I find it very annoying what is the point of being the frequent flyer then?,,Economy Class,,,3.0,2.0,2.0,2.0,,,2,no,
