,Subject,date_published,verified,review_text,type_of_traveller,seat_type,route,date_flown,seat_comfort,cabin_staff_service,food_&_beverages,inflight_entertainment,ground_service,wifi_&_connectivity,value_for_money,recommended,aircraft
0,air-seychelles,2021-01-19 00:09:00,True,"I had booked flight back from Praslin airport where we had our hotel Lemuria back to Mahe for our international flight. So we booked flight at 5th of may directly in the airport, becouse it was near our hotel. So my trip back to Mahe was like scary movie, and all of a service for the Air Seychelles was awfull. First of all - our flight was booked for 9th may - thats sunday, this is a day off at the airport - so nobody will take phone, nobody will answer you on email, and only service for flight who dont know anything will work at the airport. Be very careful to use their flights on Sundays. In the morning 9th of may at the day of our departure we noticed that a storm comes to an islands, but we saw flights still are going, and nobody told us that something will be wrong (we had flight at 18 -40), so we packed everything and were preparing to leave. Thanks to Lemuria hotel crew at 12 o clock we were told that the airport is closed and there will be no flights today, they also sent their man to have duty in the airport if something else happened, and he called every 30 minutes. Air Seychelles didn't even get in touch with us in that day, didn't answer the phones etc. The ferry that goes only 2 times a day was already sold completely for that day. So we and other passengers had to book boats not to miss their international flights. When we arrived to the airport for our flight, planes from Air Seychelles still were not flying, and we get back home. After we get home I sent email and all information air Seychelles manager asked us for ticket refund, and we get only about 30% of money for our tickets, because we were charged for ""no show"" at non working airport, and refund charge. That's a total disgrace.  If you use them you should have some additional money for private boats. Be ready for ""no calls, no service"" at critical situations, cause you may get to the airport and it would be closed in case of weather and other transport (ferry, boats) will be unavailable at the time you noticed it.",Couple Leisure,Economy Class,Praslin to Mahe,May 2021,1.0,1.0,1.0,1.0,1.0,1.0,1,no,
1,air-seychelles,2020-01-04 00:03:00,True,"Seychelles to Johannesburg. Below average service from in flight attendants. Appalling attitude, inability to carry out basic duties. Do not respond when they are buzzed, and expect you to walk to the back of the aircraft to get what you need eg a glass of water. This is a problem as the lavatory is also at the back, so at any given time theres a queue of passengers trying to navigate through the narrow aisle at the back of the aircraft. Furthermore, they are absolutely not child friendly, and made the flight very unpleasant for me and my family.",Family Leisure,Economy Class,Seychelles to Johannesburg,March 2020,1.0,1.0,1.0,1.0,2.0,1.0,1,no,
2,air-seychelles,2020-01-12 00:01:00,False,"Johannesburg to Seychelles. Online check-in for Codeshare flight from Etihad is not possible. Airplane is a brand new 32N, no issues there. Seat comfortable, even for a five-hour flight. Wifi-based IFE has a very limited choice of films. Crew rather reserved and looked a bit bored and annoyed at the same time - friendly if approached though. Crews English is tough to understand. Loved the bright red blankets!",Couple Leisure,Economy Class,Johannesburg to Seychelles,January 2020,4.0,3.0,4.0,2.0,3.0,,4,yes,A32N
3,air-seychelles,2019-01-10 00:09:00,True,"Johannesburg to Mumbai via Mahe. My wife and mother-in-law travelled with our 5 year old son and 1 year old son. While flying from Johannesburg to Seychelles, our younger sons cries more than normal day in home. My family reached Seychelles island and cabin crew decided that my baby has high fever and not to show of next connected flight. My family was forced to go to hospital and the doctor decided that it is not high fever and having ear infection. First of all the airport doesn't have any facilities to check this kind of basic things. While coming back from airport, the lady who followed with my wife forcefully taken the medical report from my wife. May be they can use that for getting some extra money somehow. The drama starts now. Initially they told that they will arrange everything, but they changed the decision. I was in south Africa and I never had a medium to contact with my wife and airport wifi also not working as like other. So I couldn't able to tell everything at right time, so unfortunately I don't have Dr report. Seychelles support staff said that only option is to book the accomodation and book Srilankan Airways which is the next flight to Mumbai and will be reaching Mumbai after 36 hours or something. So ideally we need to book everything from our pocket and even they will not help for getting taxi to the hotel. My family has three check in bag and two child. With help of my friends here in SA, I immediately booked Emirates flight and my wife told me that she will wait in airport for 8 hours for emirates. My family waited 8 hours without anything to eat. You cant get anything to eat if your family waiting for the flight that time. I am waiting for my family check in from Dubai.",Family Leisure,Economy Class,Johannesburg to Mumbai via Mahe,September 2019,1.0,1.0,1.0,1.0,1.0,1.0,1,no,
4,air-seychelles,2019-01-20 00:08:00,False,"Well, we never got to actually fly. It was supposed to be a two-day break in the Seychelles on the way from Madagascar to the UAE. First it became a one-day break because the airline changed the flight from the morning to the evening. It then sent several emails asking to bid for an upgrade. But on the day of the flight they didn’t bother to tell us that they had decided to cancel it. We showed up in the airport and were in limbo for nearly 24 hrs about when and whether we would fly on. At the end we bought new and more expensive tickets on South African Airlines to get to work on Monday. Didn’t get to see the Seychelles. Didn’t get our money back. And have yet to be able to reach anyone at Air Seychelles — the call center doesn’t appear to be staffed. Avoid at all cost.",Couple Leisure,Economy Class,Antananarivo to Abu Dhabi via Mahe,August 2019,1.0,1.0,,,1.0,,1,no,
5,air-seychelles,2019-01-14 00:08:00,False,Mauritius to Seychelles. Nearly ruined my honeymoon by cancelling a flight with only 3 days notice. Had to scramble to book / cancel hotels and transfers. Will never use them again and will advise friends and family not too either.,Couple Leisure,Economy Class,Mauritius to Seychelles,August 2019,,,,,,,1,no,
6,air-seychelles,2019-01-08 00:07:00,True,"I purchased a ticket directly from Air Seychelles for Mauritius to Mahe In the end, I was not able to travel, and so I did not make the flight. I have been trying to get in touch with them about a refund (not a full refund but a refund of all fees and fares less some penalty), but all they did was send me an automated reply saying that they were working on it. I even tried to get in touch with customer service, whom I previously had some contact with about another ticketing issue. And all she said this time around was that she would refer my case to the ""appropriate department"", which never happened, as this happened in March and we are into July now. So in one word, avoid Air Seychelles!",Solo Leisure,Economy Class,Mauritius to Mahe,February 2019,,,,,,,1,no,
7,air-seychelles,2019-01-13 00:04:00,True,"Johannesburg to Mumbai via Mahe. The staff in flight and at the airport must be the most unfriendliest you'll meet. For the entire flight of passengers there's 2 people at 1 counter doing the check in. Takes 45 mins. For a flight half full. The guy at the luggage scan asked us to make it quick as the flight is leaving as if it was our fault theres only 1 counter receiving check ins. There is no time in transit, you're shipped from 1 flight to the other. There is no place to smoke. But was advised by a guy that smoking in the toilet isn't permitted but allowed. It's the smallest airport I've been to with barely any facilities. Taking all this into consideration I see no reason why they should have an attitude. Flights itself are clean but outdated in entertainment. If you not fussy this is a cheap alternative. If you need to travel in some comfort pay more.",Business,Economy Class,Johannesburg to Mumbai via Mahe,April 2019,3.0,2.0,2.0,1.0,1.0,1.0,4,no,A320-200
8,air-seychelles,2019-01-01 00:04:00,True,"Abu Dhabi to Mahe. Worst service we have ever encountered. We booked a vegan meal by email and received confirmation for both flights (return). On the first flight we were told that they had no food for us, as in they never received any food that is meant to be for us in the first place. On the second trip back, we double checked with check in staff about our meals and they said there was nothing mentioned next to our names on the system! we then asked them to add it again and they did while we were standing. Again on the plane we were told our names were not on the list to begin with so no food for us one more time. Food aside, we were moved to from an 8pm flight to 10pm flight without prior notice. Also, we knew other groups that were boarding the same flight as us by they were not shifted but they kept them on their same flight. Initially we were told it was due to system error and all 8pm passengers were shifted to 10 pm but if that was the case then how come we were the ONLY ones shifted?? Will never ever fly again. Also, many people in the airport were complaining about having their flights being shifted TWICE! Avoid this service.",Couple Leisure,Economy Class,Abu Dhabi to Mahe,March 2019,1.0,2.0,1.0,2.0,1.0,,1,no,
9,air-seychelles,2018-01-16 00:12:00,True,Johannesburg to Mahe. I have never received such disgusting service as with Air Seychelles.  My luggage never arrived from Johannesburg and I had to deal with a rude lady in Mahe who told me my bag would be on the flight the following evening and sent to La Digue. They gave me a number to follow up on that when finally someone did answer they just said they don't know where my luggage is and put the phone down on me. They put the phone down on my mother as well. Surprise my luggage never arrived.,Couple Leisure,Economy Class,Johannesburg to Mahe,December 2018,1.0,1.0,1.0,1.0,1.0,1.0,1,no,
10,air-seychelles,2018-01-19 00:11:00,True,Johannesburg to Mumbai via Seychelles. Terrible airline to fly with. They will try to scam money out of you any way they can. Staff are extremely rude and unhelpful. Do yourself a favor and pay a little bit more to go with a reputable airline.,Solo Leisure,Economy Class,Johannesburg to Mumbai via Seychelles,October 2018,2.0,1.0,2.0,2.0,1.0,1.0,1,no,
11,air-seychelles,2018-01-03 00:10:00,True,"Johannesburg to Seychelles. On the 4.5 hour flight the cabin flight attendants made only one trolley run with food and drinks, and that only after two hours in the air. By contrast, Air Namibia on a 1.5 hour flight do a drinks run, a food run and still a coffee tea run afterwards during the flight. Kenya Airways on a 4 hour run from Johannesburg do several drink runs in addition to the food run during that time. Air Seychelles cabin staff are not friendly and do not really care about the passengers. Its the worst service I have ever had on a flight.",Solo Leisure,Economy Class,Johannesburg to Seychelles,September 2018,3.0,1.0,1.0,2.0,3.0,,4,no,A320
12,air-seychelles,2017-01-26 00:09:00,True,"Johannesburg to Mumbai via Mahe, connecting to Hyderabad with Jet Airways. Flight was delayed in Mahe Airport for 4 hours then we missed connecting flight in Mumbai and we waited more then 5 hours in Mumbai Airport as they booked flights. There was no one to help us, it was bad customer service. Passengers were struggling to get the tickets for connecting flights. They made us to stood at counter for more then 2 hours, tickets had to be booked before we reach Mumbai Airport but they booked later we reached in Mumbai airport. Accommodation must be provided if there is a delay for more then 4 hours, but they didn't provide anything and didn't respond well in Mumbai Airport.",Business,Economy Class,Johannesburg to Mumbai via Mahe,September 2017,1.0,1.0,2.0,,1.0,,1,no,
13,air-seychelles,2017-01-26 00:07:00,True,"Me and my husband had a horrible experience flying Air Seychelles from Mauritius to Mumbai via Mahe. Particularly poor was the flight from Mahe to Mumbai. At Mahe airport when we asked for a seat selection, we were rudely turned down. We could see other people standing behind us get the front seats. This was unfair and uncalled for. To top it off on the 4.5 hour flight from Mahe to Mumbai we were not even given blankets. When we asked about the blankets, the cabin crew told us that they had limited supply. Complaints to management fell on deaf years. All they offered were 5000 measly miles which could be cashed in on our next flight with Air Seychelles. Avoid if you can.",Couple Leisure,Economy Class,Mauritius to Mumbai via Mahe,February 2017,1.0,1.0,1.0,1.0,1.0,1.0,1,no,A320
14,air-seychelles,2017-01-10 00:07:00,True,"Not a good experience with Air Seychelles from Durban to Mumbai via Seychelles. Flight to Mumbai cancelled once we landed at Seychelles airport. Staff very unfriendly. stranded overnight. On return, staff had to be called several times to ask for blankets. No choice as to meal as meat was finished. TV screen never worked. Despite sending an online complaint, I still wait for a response. Their service seems to be very bad. No apology for the cancellation of the flight which affected our entire itinerary. I have completed the online survey and send a personal email but no acknowledgement or response. Will never use this airline or recommend it to anyone. I will stick with Emirates despite the longer route",Family Leisure,Economy Class,Durban to Mumbai via Seychelles,June 2017,2.0,3.0,2.0,2.0,2.0,2.0,2,no,A340
15,air-seychelles,2017-01-25 00:06:00,True,"Seychelles to Mumbai. The worst flight I've had. After a 3.5 hr delay, they refused to provide any assistance and staff was too confused to help us at Mumbai. Would recommend taking some other airline rather than wasting your money on this one.",Family Leisure,Economy Class,Seychelles to Mumbai,June 2017,2.0,2.0,1.0,1.0,1.0,1.0,1,no,
16,air-seychelles,2017-01-19 00:06:00,True,"Antananarivo to Abu Dhabi via Mahe. I have never experienced such a bad service! Lots of delays,mechanical problems with aircraft. No clear communication what was happening with the engine problems and updates so very stressy for all passengers to make connections. Very outdated aircraft. Problems with boarding pass issuing for many passengers while transiting in Seychelles! Frustrating with inadequate ground staff follow up! Halfway the food service some meals where already out of stock. Super rude check in at Antananarivo Airport. I have a silver frequent flyer card from Etihad which is their partner and normally my allowance was 40 kg. I arrived with a surfboard back and had to take out 8 kg as they said they only allow 32kg. My other bag was already checked in so i had to take it all as carry on.There where laughing and showed no mercy at check in-no humanity. I can't understand why a world class airline like Etihad teams up with them. This is island style aviation at its worst! Will take my business somewhere else.",Family Leisure,Economy Class,Antananarivo to Abu Dhabi via Mahe,June 2017,1.0,1.0,1.0,1.0,1.0,1.0,1,no,A330
17,air-seychelles,2017-01-25 00:05:00,True,"Mauritius to Mumbai via Mahe. We had a horrible experience flying Air Seychelles. Particularly Mahe to Mumbai. We took Air Seychelles flight from Mauritius to Mahe - at Mahe airport for our onward flight from mahe to mumbai, when we politely requested to give us seats in the front of the economy - we were rudely turned down. How difficult is it to give 2 tickets in the front where in the tickets that were given to us were in the last and second last row - not even together - really unprofessional, unfair, rude. To top it in the 4 and half hour flight from Mahe to Mumbai we were not given the blankets. When asked about the blankets, the cabin crew told us that they had limited supply and they gave it to seats 6 to 15. The cabin crew did not even come and ask us about disembarkation form.",Couple Leisure,Economy Class,Mauritius to Mumbai via Mahe,February 2017,2.0,1.0,2.0,3.0,1.0,1.0,1,no,
18,air-seychelles,2016-01-18 00:11:00,True,"We had the worst air travel experience with Air Seychelles, flying from Antananarivo, Madagascar to Kathmandu, Nepal on 11/4/2016. We had two transfers - Mahe and Mumbai. We were treated like illegal immigrants and forced to stay at the airport overnight because the supervisor on ground in Mahe. We flew from Tana to Mahe. When we arrived Mahe, they refused to issue us boarding passes for our next two connections (Mahe-Mumbai-KTM) because we did not have onward tickets after Nepal. We explained that we are backpackers. We travel by land mostly and plan to cross the border by car from Nepal to India. The supervisor told us she will check and disappeared. When we asked about our flight, she said we still have time and she will not leave us behind. We waited in the airport until 9:10pm when our connection flight to Mumbai was boarding. By that time, we've purchased our onward ticket from KTM to Delhi as we cannot afford to miss the flight. We showed our ticket to one of the staff. The first thing she told us is we cannot boarding our flight because the gate is closed! Then when she phoned the supervisor, who demanded to see our India visa, which was completely irrelevant. We waited there thinking the supervisor will come back to us, but they just let us miss the flight like that! Even after we had all the documents they asked for. In the end, the supervisor never showed up and they did not let us board our flight even though we had the onward tickets. We were dumped in the airport without any explanation. We did not know why we need to show the airline our India visa while we are just flying to Nepal and what should we do for the flights that we've missed. When the supervisor showed up around midnight, she said we will have to wait for the next day to rearrange the tickets and just disappeared again. They tried to send us to a hotel but it was too late, the immigration officer didn't let us pass. Therefore, we were forced to sleep in the airport. The next day we spoke with numerous staff about our issue, including the supervisors and duty managers. None of them helped. In the end, we were able to board the flight that day withy the same documents we had a night before, which means we could've boarded our original flight!",Couple Leisure,Economy Class,TNR to KTM via SEZ / BOM,November 2016,2.0,2.0,,,1.0,,1,no,
19,air-seychelles,2016-01-05 00:11:00,True,"Johannesburg to Seychelles. First time travelling with Air Seychelles and I was very impressed. Ground staff was very helpful. Food was excellent, cabin staff was friendly. The flight was comfortable and there was a variety of entertainment on board. Great airline would definitely recommend.",Solo Leisure,Economy Class,JNB to SEZ,November 2016,4.0,4.0,5.0,4.0,5.0,,5,yes,
20,air-seychelles,2016-01-03 00:08:00,True,I wanted to bring to your attention the pathetic experience I have recently had flying Air Seychelles and its partner Etihad on the Mumbai-Dar Es Salaam-Mumbai route. I  booked a confirmed Air Seychelles Mumbai to Dar Es Salaam via Mahe return flights on January 2016 for July 2016. A month later we were informed that Air Seychelles has stopped flying that route and has shifted us to Etihad flight via Abu Dhabi. I confirmed with the Mumbai office of Air Seychelles and the flight was confirmed. A week before flying I checked with Etihad online and they informed me that my Abu Dhabi to Dar es Salaam sector was not confirmed. Neither Air Seychelles nor Etihad had taken the effort to inform me of this situation in spite of purchasing a confirmed ticket in January! If I had not followed up I would have been stranded in Abu Dhabi. The Air Seychelles ground office in Mumbai was equally clueless. Repeated emails from them to Air Seychelles and Etihad (on highest priority I was told) went unanswered. Only after I threatened to take action did they swing into action and book us on Kenya Airways. As a gesture we were informed that a special request for upgrade to Business class has been put but of course as expected there was no record on the system during check in. Also the complimentary chauffeur service from Etihad was not available as the PNR was 'not registered' in the system. The only explanation that I was offered was 'a system glitch'. This is irresponsible of both Air Seychelles and Etihad. I will definitely not be flying either airline. I would rather pay more and go by a more reliable airline like Emirates or Qatar Airways. Both Etihad and Air Seychelles promise a lot but once the money is exchanged forget their responsibility.,Couple Leisure,Economy Class,BOM to DAR via NBO,July 2016,3.0,3.0,3.0,4.0,1.0,1.0,1,no,A320 / Boeing 777
21,air-seychelles,2016-01-04 00:06:00,,"Uncomfortable, hardly any leg room and the cabin was so hot that it made it almost unbearable to be on the flight from Abu Dhabi to the Seychelles. However, on the return flight with Air Seychelles it was much better with a cooler cabin and much nicer staff. There were not as many passengers on the way back so we got to lay across the seats and sleep. Don't bother getting the front seats have don't have anymore room than the ones behind.",Family Leisure,Economy Class,AUH to SEZ,May 2016,3.0,4.0,3.0,3.0,4.0,,3,yes,A320
22,air-seychelles,2016-01-22 00:03:00,,"Abu Dhabi to Mauritius via Mahe. Previously the schedule and food were much better. One could leave around 9.20 am same day and arrive around 16.00 hours. Now, with Air Seychelles, one has to leave residence at 11.00 pm to reach destination around 12.20 next day, ie very odd hours. On top of that the transit time in Mahe, is now more than 2 hours. Seychelles has plenty of quality fish, yet the food served on both legs is appalling, only 2 breakfasts. Overall, only the dessert was good. It is preferable to pay partly for the food and obtain better quality.",Family Leisure,Economy Class,AUH to MRU via SEZ,July 2015,2.0,2.0,1.0,2.0,2.0,2.0,2,no,
23,air-seychelles,2016-01-25 00:02:00,,"First of all while booking online, only Credit Card payments are allowed - they don't allow netbanking or debit Card payments. No Option of changing your meal or seat preferences after booking. No Option to enter loyality Programme Details after booking. No option of online checkin - real shame who has design this Website. Before flying itself faced too much problems.",Couple Leisure,Economy Class,JNB to BOM via SEZ,February 2016,1.0,2.0,2.0,1.0,1.0,,2,no,
24,air-seychelles,2016-01-24 00:02:00,,"On original check in at Durban could check in baggage but SAA could not print Air Seychelles boarding pass. Re-check in at Johannesburg very slow with long queues, although very pleasant staff. Aircraft showed lack of cosmetic maintenance despite being fairly new such as loose seat pockets. Decent legroom and A330 seating configuration 2-4-2 preferable to Boeing. Service very slow after take off, first hour spent handing out immigration forms. Food was good but drinks, water or wine, in tiny quantities with no offer of refill. No walk around service after meal, although call button was responded to. Reasonable flight but do not be taken in by ""Creole experience"" punted on their website.",Business,Economy Class,DUR to SEZ via JNB,February 2016,4.0,3.0,3.0,3.0,2.0,3.0,3,yes,A330
25,air-seychelles,2016-01-02 00:02:00,,"Flew Air Seychelles from Seychelles to Praslin Island. Friendly staff, but a tiny plane (as it was a 10 minute inter-island flight), so small that I couldn't stand up, but it was clean and new. The flight was smooth, and non-eventful. The seats weren't comfortable, and there were arranged in a two-one layout. The plane's livery needs a mention - it was one of the best I've seen.",Family Leisure,Economy Class,SEZ to PRI,August 2015,2.0,5.0,,,5.0,,5,yes,DHC6-400 Twin-Otter
